{
  "schema_version": "1.0",
  "description": "Plot 叙事质量增强规格（机器规格）——波动模型/剧情点四要素/冲突双类型/悬念密度/代价豁免。软引导（不拦截仅建议）与强制边界（违规拦截）分离：波动为软引导，四要素与冲突双类型的有伏笔要求为强制。消费方：Plot checks/c06-quality.md。",
  "tension_levels": [
    { "level": "L1", "name": "平静建立", "desc": "世界观/人物引入，埋悬念种子" },
    { "level": "L2", "name": "升温铺垫", "desc": "冲突萌芽，关系变化，张力上升" },
    { "level": "L3", "name": "中度冲突", "desc": "矛盾显性化，小规模对抗" },
    { "level": "L4", "name": "第一波峰", "desc": "第一次大转折/重大代价，情绪顶点" },
    { "level": "L5", "name": "最终波峰", "desc": "总爆发/大高潮/回收主线" }
  ],
  "wave_guidance": {
    "mode": "软引导——不满足不拦截，仅输出波动建议（防止硬约束逼迫 LLM 复用素材）",
    "rules": [
      "相邻阶段张力差 ≥1（禁止连续同张力——防平铺）",
      "全本至少 2 个波峰（L4+）",
      "波峰阶段必须包含代价事件（失去/受伤/背叛/牺牲）",
      "低谷阶段（张力回落）必须埋 ≥1 条新伏笔（为最终波峰蓄力）"
    ],
    "suggest_format": "波动建议：该阶段与上一阶段张力持平，可考虑升温或留白"
  },
  "plot_point_requirements": {
    "mode": "强制——辅助/自动生成必填四要素，手动校验必查",
    "four_elements": [
      { "name": "冲突", "desc": "谁与谁的对抗（人物/环境/内心）——无冲突的剧情点 = 无效点", "subtypes": ["有伏笔冲突", "无伏笔冲突"] },
      { "name": "代价", "desc": "达成/推进目标付出的代价（失去/受伤/妥协/道德污点）" },
      { "name": "变化", "desc": "该点之后人物状态/关系/世界状态的不可逆变化" },
      { "name": "悬念", "desc": "该点埋下或回收的悬念（与伏笔体系联动）" }
    ],
    "violations": [
      "冲突要素缺失 → 违规（剧情点无效）",
      "连续 2 个剧情点无代价 → 违规",
      "整阶段无悬念 → 违规",
      "转折点无状态变化 → 违规"
    ]
  },
  "conflict_types": {
    "有伏笔冲突": {
      "desc": "由既有伏笔/前期线索引发的冲突——兑现伏笔、深度感、因果闭环",
      "rule": "每阶段至少 1 个（强制，四要素冲突标注类型）",
      "link": "long-skill foreshadowing（兑现/回收既有伏笔或埋设新伏笔）"
    },
    "无伏笔冲突": {
      "desc": "直接对抗/突发事件（无预埋）——打破预期、制造意外、节奏变量",
      "rule": "不得连续 ≥3 阶段主导（软引导，防事故流水账）"
    }
  },
  "suspense_density": {
    "rule": "每阶段 ≥1 悬念（埋或收）",
    "global": "全书伏笔有去有回（沿用 long-skill foreshadowing 诊断：未回收 ≥5 条或单条跨越 ≥10 章提醒）"
  },
  "cost_exemption": {
    "default": "默认强制代价——主角成长/胜利必须伴随代价（失去/受伤/妥协/道德污点）",
    "exempt": "用户明确声明爽文/无代价偏好时豁免——记录于项目信息或写作偏好库（user_style_enabled 启用时优先读写作偏好）"
  }
}
